{
  "$schema": "http://json-schema.org/draft-04/schema#",
  "id": "",
  "type": "object",
  "properties": {
    "urn": {
      "id": "/urn",
      "type": "string"
    },
    "aggregateCaseId": {
      "id": "/aggregateCaseId",
      "type": "string"
    },
    "version": {
      "id": "/version",
      "type": "integer"
    },
    "eventId": {
      "id": "/eventId",
      "type": "string"
    },
    "defendant": {
      "id": "/defendant",
      "type": "object",
      "properties": {
        "id": {
          "id": "/defendant/id",
          "type": "integer"
        },
        "firstName": {
          "id": "/defendant/firstName",
          "type": "string"
        },
        "lastName": {
          "id": "/defendant/lastName",
          "type": "string"
        },
        "dateOfBirth": {
          "id": "/defendant/dateOfBirth",
          "type": "string"
        },
        "charge": {
          "id": "/defendant/charge",
          "type": "object",
          "properties": {
            "id": {
              "id": "/defendant/charge/id",
              "type": "integer"
            },
            "description": {
              "id": "/defendant/charge/description",
              "type": "string"
            },
            "pleas": {
              "id": "/defendant/charge/pleas",
              "type": "object",
              "properties": {
                "anticipatedPlea": {
                  "id": "/defendant/charge/pleas/anticipatedPlea",
                  "type": "string"
                },
                "anticipatedIssue": {
                  "id": "/defendant/charge/pleas/anticipatedIssue",
                  "type": "string"
                },
                "anticipatedIssueDetail": {
                  "id": "/defendant/charge/pleas/anticipatedIssueDetail",
                  "type": "string"
                },
                "indicatedPlea": {
                  "id": "/defendant/charge/pleas/indicatedPlea",
                  "type": "string"
                },
                "indicatedIssue": {
                  "id": "/defendant/charge/pleas/indicatedIssue",
                  "type": "string"
                },
                "indicatedIssueDetail": {
                  "id": "/defendant/charge/pleas/indicatedIssueDetail",
                  "type": "string"
                }
              }
            }
          }
        }
      }
    },
    "directions": {
      "id": "/directions",
      "type": "array",
      "items": [
        {
          "id": "/directions/0",
          "type": "object",
          "properties": {
            "title": {
              "id": "/directions/0/title",
              "type": "string"
            },
            "statutoryReference": {
              "id": "/directions/0/statutoryReference",
              "type": "string"
            },
            "instructions": {
              "id": "/directions/0/instructions",
              "type": "array",
              "items": [
                {
                  "id": "/directions/0/instructions/0",
                  "type": "object",
                  "properties": {
                    "id": {
                      "id": "/directions/0/instructions/0/id",
                      "type": "string"
                    },
                    "description": {
                      "id": "/directions/0/instructions/0/description",
                      "type": "string"
                    },
                    "timeLimit": {
                      "id": "/directions/0/instructions/0/timeLimit",
                      "type": "string"
                    },
                    "timeLimitNote": {
                      "id": "/directions/0/instructions/0/timeLimitNote",
                      "type": "string"
                    },
                    "assignee": {
                      "id": "/directions/0/instructions/0/assignee",
                      "type": "string"
                    }
                  }
                },
                {
                  "id": "/directions/0/instructions/1",
                  "type": "object",
                  "properties": {
                    "id": {
                      "id": "/directions/0/instructions/1/id",
                      "type": "string"
                    },
                    "description": {
                      "id": "/directions/0/instructions/1/description",
                      "type": "string"
                    },
                    "timeLimit": {
                      "id": "/directions/0/instructions/1/timeLimit",
                      "type": "string"
                    },
                    "timeLimitNote": {
                      "id": "/directions/0/instructions/1/timeLimitNote",
                      "type": "string"
                    },
                    "assignee": {
                      "id": "/directions/0/instructions/1/assignee",
                      "type": "string"
                    }
                  }
                }
              ]
            }
          }
        },
        {
          "id": "/directions/1",
          "type": "object",
          "properties": {
            "title": {
              "id": "/directions/1/title",
              "type": "string"
            },
            "statutoryReference": {
              "id": "/directions/1/statutoryReference",
              "type": "string"
            },
            "instructions": {
              "id": "/directions/1/instructions",
              "type": "array",
              "items": {
                "id": "/directions/1/instructions/0",
                "type": "object",
                "properties": {
                  "id": {
                    "id": "/directions/1/instructions/0/id",
                    "type": "string"
                  },
                  "description": {
                    "id": "/directions/1/instructions/0/description",
                    "type": "string"
                  },
                  "subInstructions": {
                    "id": "/directions/1/instructions/0/subInstructions",
                    "type": "array",
                    "items": [
                      {
                        "id": "/directions/1/instructions/0/subInstructions/0",
                        "type": "object",
                        "properties": {
                          "id": {
                            "id": "/directions/1/instructions/0/subInstructions/0/id",
                            "type": "string"
                          },
                          "description": {
                            "id": "/directions/1/instructions/0/subInstructions/0/description",
                            "type": "string"
                          },
                          "timeLimit": {
                            "id": "/directions/1/instructions/0/subInstructions/0/timeLimit",
                            "type": "string"
                          },
                          "timeLimitNote": {
                            "id": "/directions/1/instructions/0/subInstructions/0/timeLimitNote",
                            "type": "string"
                          },
                          "assignee": {
                            "id": "/directions/1/instructions/0/subInstructions/0/assignee",
                            "type": "string"
                          }
                        }
                      },
                      {
                        "id": "/directions/1/instructions/0/subInstructions/1",
                        "type": "object",
                        "properties": {
                          "id": {
                            "id": "/directions/1/instructions/0/subInstructions/1/id",
                            "type": "string"
                          },
                          "description": {
                            "id": "/directions/1/instructions/0/subInstructions/1/description",
                            "type": "string"
                          },
                          "timeLimit": {
                            "id": "/directions/1/instructions/0/subInstructions/1/timeLimit",
                            "type": "string"
                          },
                          "timeLimitNote": {
                            "id": "/directions/1/instructions/0/subInstructions/1/timeLimitNote",
                            "type": "string"
                          },
                          "assignee": {
                            "id": "/directions/1/instructions/0/subInstructions/1/assignee",
                            "type": "string"
                          }
                        }
                      }
                    ]
                  }
                }
              }
            }
          }
        },
        {
          "id": "/directions/2",
          "type": "object",
          "properties": {
            "title": {
              "id": "/directions/2/title",
              "type": "string"
            },
            "statutoryReference": {
              "id": "/directions/2/statutoryReference",
              "type": "string"
            },
            "instructions": {
              "id": "/directions/2/instructions",
              "type": "array",
              "items": [
                {
                  "id": "/directions/2/instructions/0",
                  "type": "object",
                  "properties": {
                    "id": {
                      "id": "/directions/2/instructions/0/id",
                      "type": "string"
                    },
                    "description": {
                      "id": "/directions/2/instructions/0/description",
                      "type": "string"
                    },
                    "timeLimit": {
                      "id": "/directions/2/instructions/0/timeLimit",
                      "type": "string"
                    },
                    "timeLimitNote": {
                      "id": "/directions/2/instructions/0/timeLimitNote",
                      "type": "string"
                    },
                    "assignee": {
                      "id": "/directions/2/instructions/0/assignee",
                      "type": "string"
                    }
                  }
                },
                {
                  "id": "/directions/2/instructions/1",
                  "type": "object",
                  "properties": {
                    "id": {
                      "id": "/directions/2/instructions/1/id",
                      "type": "string"
                    },
                    "description": {
                      "id": "/directions/2/instructions/1/description",
                      "type": "string"
                    },
                    "timeLimit": {
                      "id": "/directions/2/instructions/1/timeLimit",
                      "type": "string"
                    },
                    "timeLimitNote": {
                      "id": "/directions/2/instructions/1/timeLimitNote",
                      "type": "string"
                    },
                    "assignee": {
                      "id": "/directions/2/instructions/1/assignee",
                      "type": "string"
                    }
                  }
                }
              ]
            }
          }
        }
      ]
    }
  },
  "required": [
    "urn",
    "aggregateCaseId",
    "version",
    "eventId",
    "defendant",
    "directions"
  ]
}